{
  "$schema": "./path-types.schema.json",
  "schema_version": 1,
  "_comment": "Repository path-type tags for src/manifest_agent/checks/path_filters.py. `valid_types` lists every tag a check's `types`/`types_or` may reference (includes the cross-cutting `executable`/`text` tags identify applies to every regular file, see path_filters.py's `_path_tags`). `suffix_tags` maps a lowercase file suffix to the tag(s) it implies, mirroring pre-commit `identify`.",
  "valid_types": [
    "executable",
    "go",
    "javascript",
    "json",
    "jsx",
    "markdown",
    "pyi",
    "python",
    "rust",
    "shell",
    "terraform",
    "text",
    "ts",
    "tsx",
    "yaml"
  ],
  "suffix_tags": {
    ".bash": ["shell"],
    ".bats": ["shell"],
    ".cjs": ["javascript"],
    ".go": ["go"],
    ".js": ["javascript"],
    ".json": ["json"],
    ".jsx": ["jsx"],
    ".markdown": ["markdown"],
    ".md": ["markdown"],
    ".mjs": ["javascript"],
    ".py": ["python"],
    ".pyi": ["pyi"],
    ".rs": ["rust"],
    ".sh": ["shell"],
    ".tf": ["terraform"],
    ".tfvars": ["terraform"],
    ".ts": ["ts"],
    ".tsx": ["tsx"],
    ".yaml": ["yaml"],
    ".yml": ["yaml"]
  }
}
